{
  "name": "eukota-claude-marketplace",
  "owner": {
    "name": "Darrell Ross"
  },
  "metadata": {
    "description": "Personal Claude marketplace by Darrell Ross",
    "version": "1.0.0",
    "pluginRoot": "plugins"
  },
  "plugins": [
    {
      "name": "plugin-builder",
      "version": "1.4.0",
      "source": "./plugins/plugin-builder",
      "description": "Tools for building Claude marketplace plugins \u2014 choosing primitives, checking name availability, smoke-testing hooks, scaffolding structure, and following conventions.",
      "license": "MIT",
      "author": {
        "name": "Darrell Ross"
      }
    },
    {
      "name": "context-setup",
      "version": "1.1.0",
      "source": "./plugins/context-setup",
      "description": "Personal project context management system for engineers \u2013 structured Markdown + YAML that gives your AI assistant persistent, organized memory across sessions and machines. Auto-maps each project's workspace folders into per-project permissions.",
      "license": "MIT",
      "author": {
        "name": "Darrell Ross"
      }
    },
    {
      "name": "meldwerkes",
      "version": "0.7.0",
      "source": "./plugins/meldwerkes",
      "description": "Meldwerkes: multi-agent cognitive architecture that builds a personalized decision model through PAHF loops, distillation, and multi-brain orchestration.",
      "license": "MIT",
      "author": {
        "name": "Darrell Ross"
      }
    },
    {
      "name": "plan-usage",
      "version": "1.0.0",
      "source": "./plugins/plan-usage",
      "description": "Tracks Claude account rate-limit usage (5-hour and 7-day windows) from the status line, and reports whether your plan is the constraint on your work.",
      "license": "MIT",
      "author": {
        "name": "Darrell Ross"
      }
    },
    {
      "name": "local-dev-standards",
      "version": "0.1.0",
      "source": "./plugins/local-dev-standards",
      "description": "Enforces standard local development practices — git worktrees, containerized package installs, Makefile start/stop targets, and hot reload.",
      "license": "MIT",
      "author": {
        "name": "Darrell Ross"
      }
    }
  ]
}
